<?xml version="1.0" encoding="UTF-8" standalone="no"?>
<!DOCTYPE logtalk SYSTEM "logtalk.dtd">
<?xml-stylesheet type="text/xsl" href="lgtxml.xsl"?>
<logtalk>
<entity>
<name><![CDATA[line(Name)]]></name>
<type>object</type>
<compilation>static, context_switching_calls</compilation>
<comment><![CDATA[A metro line]]></comment>
<parameters>
<parameter>
<name><![CDATA[Name]]></name>
<description><![CDATA[The name of the metro line]]></description>
</parameter>
</parameters>
<author><![CDATA[Sergio Castro]]></author>
</entity>
<relations>
</relations>
<predicates>
<public>
<predicate>
<name><![CDATA[name/1]]></name>
<scope>public</scope>
<compilation>static</compilation>
<comment><![CDATA[Name is the line name.]]></comment>
<template><![CDATA[name(Name)]]></template>
</predicate>
<predicate>
<name><![CDATA[connects/2]]></name>
<scope>public</scope>
<compilation>static</compilation>
<comment><![CDATA[Station1 is connected to Station2 by means of this line.]]></comment>
<template><![CDATA[connects(Station1,Station2)]]></template>
</predicate>
<predicate>
<name><![CDATA[add_connection/2]]></name>
<scope>public</scope>
<compilation>static</compilation>
<comment><![CDATA[Station1 is now connected to Station2 by means of this line.]]></comment>
<template><![CDATA[add_connection(Station1,Station2)]]></template>
</predicate>
</public>
<protected>
</protected>
<private>
</private>
</predicates>
<operators>
</operators>
<remarks>
</remarks>
</logtalk>
