<?xml version="1.0" encoding="UTF-8" standalone="no"?>
<!DOCTYPE logtalk SYSTEM "logtalk.dtd">
<?xml-stylesheet type="text/xsl" href="lgtxml.xsl"?>
<logtalk>
<entity>
<name><![CDATA[station(Name)]]></name>
<type>object</type>
<compilation>static, context_switching_calls, dynamic_declarations</compilation>
<comment><![CDATA[A metro station]]></comment>
<parameters>
<parameter>
<name><![CDATA[Name]]></name>
<description><![CDATA[The name of the station]]></description>
</parameter>
</parameters>
<author><![CDATA[Sergio Castro]]></author>
</entity>
<relations>
</relations>
<predicates>
<public>
<predicate>
<name><![CDATA[name/1]]></name>
<scope>public</scope>
<compilation>static</compilation>
<comment><![CDATA[Name is the station name.]]></comment>
<template><![CDATA[name(Name)]]></template>
</predicate>
<predicate>
<name><![CDATA[connected/1]]></name>
<scope>public</scope>
<compilation>static</compilation>
<comment><![CDATA[Station is a connected station.]]></comment>
<template><![CDATA[connected(Station)]]></template>
</predicate>
<predicate>
<name><![CDATA[connected/2]]></name>
<scope>public</scope>
<compilation>static</compilation>
<comment><![CDATA[Station is a connected station by means of Line.]]></comment>
<template><![CDATA[connected(Station,Line)]]></template>
</predicate>
<predicate>
<name><![CDATA[nearby/1]]></name>
<scope>public</scope>
<compilation>static</compilation>
<comment><![CDATA[Station is a nearby station.]]></comment>
<template><![CDATA[nearby(Station)]]></template>
</predicate>
<predicate>
<name><![CDATA[reachable/1]]></name>
<scope>public</scope>
<compilation>static</compilation>
<comment><![CDATA[Station is a reachable station.]]></comment>
<template><![CDATA[reachable(Station)]]></template>
</predicate>
<predicate>
<name><![CDATA[reachable/2]]></name>
<scope>public</scope>
<compilation>static</compilation>
<comment><![CDATA[Station is a reachable station by means of traversing IntermediateStations.]]></comment>
<template><![CDATA[reachable(Station,IntermediateStations)]]></template>
</predicate>
</public>
<protected>
</protected>
<private>
</private>
</predicates>
<operators>
</operators>
<remarks>
</remarks>
</logtalk>
