<?xml version="1.0" encoding="UTF-8" standalone="no"?>
<!DOCTYPE logtalk SYSTEM "logtalk.dtd">
<?xml-stylesheet type="text/xsl" href="lgtxml.xsl"?>
<logtalk>
<entity>
<name><![CDATA[metro]]></name>
<type>object</type>
<compilation>static, context_switching_calls</compilation>
<comment><![CDATA[The London metro. Adapted from the "Simply Logical" book by Peter Flach.]]></comment>
<author><![CDATA[Sergio Castro]]></author>
</entity>
<relations>
</relations>
<predicates>
<public>
<predicate>
<name><![CDATA[connected/3]]></name>
<scope>public</scope>
<compilation>dynamic</compilation>
<comment><![CDATA[Station1 is connected to Station2 by means of Line.]]></comment>
<template><![CDATA[connected(Station1,Station2,Line)]]></template>
</predicate>
<predicate>
<name><![CDATA[nearby/2]]></name>
<scope>public</scope>
<compilation>static</compilation>
<comment><![CDATA[Station1 is nearby Station2.]]></comment>
<template><![CDATA[nearby(Station1,Station2)]]></template>
</predicate>
<predicate>
<name><![CDATA[reachable/3]]></name>
<scope>public</scope>
<compilation>static</compilation>
<comment><![CDATA[Station2 is reachable from Station1 by means of traversing IntermediateStations.]]></comment>
<template><![CDATA[reachable(Station1,Station2,IntermediateStations)]]></template>
</predicate>
<predicate>
<name><![CDATA[line/1]]></name>
<scope>public</scope>
<compilation>static</compilation>
<comment><![CDATA[Name is the name of a Line.]]></comment>
<template><![CDATA[line(Name)]]></template>
</predicate>
<predicate>
<name><![CDATA[remove_all/0]]></name>
<scope>public</scope>
<compilation>static</compilation>
<comment><![CDATA[Removes all the lines.]]></comment>
</predicate>
</public>
<protected>
</protected>
<private>
</private>
</predicates>
<operators>
</operators>
<remarks>
</remarks>
</logtalk>
